{
  "receipt_id": "01J7Z9PM4P2X3F0K0F0A0J3T1Z",
  "prior_receipt_id": "01J7Z9PM4N2X3F0K0F0A0J3T1Y",
  "action_canonical_hash": "sha256:9f86d081884c7d659a2feaa0c55ad015a3bf4f1b2b0b822cd15d6c15b0f00a08",
  "sender_identity": "did:web:example.test/agents/seller-1",
  "receiver_identity": "did:web:example.test/agents/buyer-1",
  "timestamp": "2026-07-04T14:22:33Z",
  "signature": "4/t6ud/WfFwctRSfvrfgGQIw5kMTi9HLmZOcGpSDMz5kDy4H4Njo+c5p23Okh2k96stbLm19Zxzgzak5n/reDA==",
  "signature_algorithm": "ed25519"
}
