{
  "receipt_id": "01J8D0000000000000000H0P01",
  "prior_receipt_id": "01J8D0000000000000000GRNT1",
  "action_canonical_hash": "sha256:48f4d10a86a9992520a7fd1537a47dc7a0c9459d40a57fd8f214c823921e8f41",
  "sender_identity": "did:web:example.test/agents/agent-1",
  "receiver_identity": "did:web:example.test/tools/ledger-api",
  "timestamp": "2026-09-23T09:05:00Z",
  "signature_algorithm": "ed25519",
  "authorization": {
    "authorizing_receipt_id": "01J8D0000000000000000GRNT1",
    "delegator_identity": "did:web:example.test/agents/principal-1"
  },
  "signature": "c9wTZW8/PfdCNF3rVXFTW9GrLdQ8ny4xQVYp5kWJAkR/mhFbloMG9l1T8RGfW9V2U2MTTirk0dJiig9zVxpAAg=="
}
