{
  "receipt_id": "01J7Z9PM4Q2X3F0K0F0A0J3T20",
  "prior_receipt_id": "01J7Z9PM4P2X3F0K0F0A0J3T1Z",
  "action_canonical_hash": "sha256:2c26b46b68ffc68ff99b453c1d30413413422d706483bfa0f98a5e886266e7ae",
  "sender_identity": "did:web:example.test/agents/buyer-1",
  "receiver_identity": "did:web:example.test/agents/seller-1",
  "timestamp": "2026-07-04T14:22:35Z",
  "signature": "CCCCCCCCCCCCCCCCCCCCCCCCCCCCCCCCCCCCCCCCCCCCCCCCCCCCCCCCCCCCCCCCCCCCCCCCCCCCCCCCCCCCCC==",
  "signature_algorithm": "ed25519"
}
